[
  {
    "proposition_id": "proposition-BATCH-2026-008-001",
    "neutral_formulation": "Agent-mediated actions should be attributable to an agent identity that is distinguishable from, and linked to, the principal represented.",
    "aliases": [],
    "definition": "A traceability proposition covering distinct agent identification and preservation of the delegating human or system principal in authentication, authorization, and audit contexts.",
    "scope": "Cross-sector agent access to tools and services, especially delegated and high-stakes actions; it does not require public disclosure of identity or universal deanonymization.",
    "time_period": "Indexed source publications dated 2024-06-02 through 2026-06-01; normative claims are not treated as time-invariant facts.",
    "topic_ids": [
      "topic-ai-agents",
      "topic-ai-governance",
      "topic-cybersecurity",
      "topic-non-human-identity"
    ],
    "relevant_role_ids": [
      "role-ciso",
      "role-cio",
      "role-cto",
      "role-general-counsel",
      "role-board-director"
    ],
    "relevant_geographies": [
      "global standards context",
      "global technology standards context",
      "global policy context"
    ],
    "supporting_statement_ids": [
      "statement-BATCH-2026-006-009",
      "statement-BATCH-2026-006-013",
      "statement-BATCH-2026-006-015",
      "statement-BATCH-2026-006-016",
      "statement-BATCH-2026-006-018"
    ],
    "challenging_statement_ids": [],
    "qualifying_statement_ids": [
      "statement-BATCH-2026-006-010",
      "statement-BATCH-2026-006-045"
    ],
    "refining_statement_ids": [],
    "superseding_statement_ids": [],
    "evidence_source_ids": [
      "source-BATCH-2026-005-003",
      "source-BATCH-2026-005-004",
      "source-BATCH-2026-005-009"
    ],
    "proposition_status": "candidate_pending_human_review",
    "ambiguity_notes": "Identifier persistence, privacy properties, and the strength of the principal link remain implementation-dependent.",
    "source_diversity_metrics": {
      "independent_people": 42,
      "independent_organizations": 3,
      "publishers": 3,
      "source_types": [
        "research_report",
        "working_paper"
      ],
      "intellectual_sources": 3,
      "off_owned_source_share": 0,
      "consulting_source_share": 0,
      "vendor_source_share": 0.3333333333333333,
      "geographic_contexts": [
        "global policy context",
        "global standards context",
        "global technology standards context"
      ],
      "role_contexts": [
        "role-ciso",
        "role-cio",
        "role-cto",
        "role-general-counsel",
        "role-board-director"
      ],
      "geographic_concentration": {
        "status": "high_or_not_measurable",
        "basis": "Normative records use United States or global contexts; benchmark records have no human geography. No region-comparative evidence is present."
      },
      "role_concentration": {
        "coded_roles": 5,
        "direct_role_specific_position_sources": 0,
        "status": "not_measurable_from_shared_relevance_tags",
        "basis": "The same executive-relevance tags apply to all supplied statements; the corpus does not measure positions by role."
      },
      "leading_source_id": "source-BATCH-2026-005-003",
      "leading_source_statement_share": 0.429,
      "high_concentration": true,
      "concentration_basis": "Share of this proposition’s mapped statement relationships attributable to the leading intellectual source; warning threshold > 0.40."
    },
    "ownership_concentration_warning": true,
    "publication_status": null,
    "workflow_status": "propositions_mapped",
    "machine_review_status": "ready_for_human_review",
    "human_review_status": "pending",
    "reviewed_by": null,
    "reviewed_at": null,
    "provenance": [
      {
        "source_url": "https://www.ietf.org/archive/id/draft-klrc-aiagent-auth-02.html",
        "accessed_at": "2026-08-15",
        "retrieval_method": "normalized from independently checked source statements and source/person records",
        "exact_locator": "Mapped statement IDs: statement-BATCH-2026-006-009, statement-BATCH-2026-006-010, statement-BATCH-2026-006-013",
        "content_hash": "e34f335c56546a6d91d88d43159c9f80d4dcfbbad020d41c31607fc56848befa",
        "batch_id": "BATCH-2026-008",
        "prompt_id": "OEII-PROPOSITION-MAPPING",
        "prompt_version": "2.0",
        "notes": "Staging proposition candidate; named human review pending."
      },
      {
        "source_url": "https://openid.net/wp-content/uploads/2025/10/Identity-Management-for-Agentic-AI.pdf",
        "accessed_at": "2026-08-15",
        "retrieval_method": "normalized from independently checked source statements and source/person records",
        "exact_locator": "Mapped statement IDs: statement-BATCH-2026-006-015, statement-BATCH-2026-006-016, statement-BATCH-2026-006-018",
        "content_hash": "e6a0e5909fcb2486568180f69d511ae2af8d20a1bfb3028b39b3d1072846f4f3",
        "batch_id": "BATCH-2026-008",
        "prompt_id": "OEII-PROPOSITION-MAPPING",
        "prompt_version": "2.0",
        "notes": "Staging proposition candidate; named human review pending."
      },
      {
        "source_url": "https://cdn.openai.com/papers/practices-for-governing-agentic-ai-systems.pdf",
        "accessed_at": "2026-08-15",
        "retrieval_method": "normalized from independently checked source statements and source/person records",
        "exact_locator": "Mapped statement IDs: statement-BATCH-2026-006-045",
        "content_hash": "22b3a8607ed781a848b82b0bfe8e638b16cd027aac90a19b2aecf236063d0e7c",
        "batch_id": "BATCH-2026-008",
        "prompt_id": "OEII-PROPOSITION-MAPPING",
        "prompt_version": "2.0",
        "notes": "Staging proposition candidate; named human review pending."
      }
    ],
    "revision_history": [
      {
        "changed_at": "2026-08-15T23:30:00Z",
        "changed_by": "OpenAI Codex",
        "summary": "Created normalized, scope-preserving staging proposition from independently checked statements.",
        "batch_id": "BATCH-2026-008"
      }
    ]
  },
  {
    "proposition_id": "proposition-BATCH-2026-008-002",
    "neutral_formulation": "Agent identities and credentials should be governed through explicit lifecycle controls, including scoped issuance, short validity, permission change, transfer, revocation, and de-provisioning.",
    "aliases": [],
    "definition": "A lifecycle proposition connecting runtime credential constraints with enterprise management of non-human agent identities.",
    "scope": "Enterprise and standards-based identity management for runtime AI agents; it does not prescribe a single protocol or credential format.",
    "time_period": "Indexed source publications dated 2024-06-02 through 2026-06-01; normative claims are not treated as time-invariant facts.",
    "topic_ids": [
      "topic-ai-agents",
      "topic-ai-governance",
      "topic-cybersecurity",
      "topic-non-human-identity"
    ],
    "relevant_role_ids": [
      "role-ciso",
      "role-cio",
      "role-cto",
      "role-general-counsel",
      "role-board-director"
    ],
    "relevant_geographies": [
      "global standards context",
      "global technology standards context"
    ],
    "supporting_statement_ids": [
      "statement-BATCH-2026-006-011",
      "statement-BATCH-2026-006-017",
      "statement-BATCH-2026-006-019"
    ],
    "challenging_statement_ids": [],
    "qualifying_statement_ids": [
      "statement-BATCH-2026-006-012"
    ],
    "refining_statement_ids": [],
    "superseding_statement_ids": [],
    "evidence_source_ids": [
      "source-BATCH-2026-005-003",
      "source-BATCH-2026-005-004"
    ],
    "proposition_status": "candidate_pending_human_review",
    "ambiguity_notes": "The indexed sources propose controls but do not provide comparative implementation or interoperability evidence.",
    "source_diversity_metrics": {
      "independent_people": 26,
      "independent_organizations": 2,
      "publishers": 2,
      "source_types": [
        "research_report",
        "working_paper"
      ],
      "intellectual_sources": 2,
      "off_owned_source_share": 0,
      "consulting_source_share": 0,
      "vendor_source_share": 0,
      "geographic_contexts": [
        "global standards context",
        "global technology standards context"
      ],
      "role_contexts": [
        "role-ciso",
        "role-cio",
        "role-cto",
        "role-general-counsel",
        "role-board-director"
      ],
      "geographic_concentration": {
        "status": "high_or_not_measurable",
        "basis": "Normative records use United States or global contexts; benchmark records have no human geography. No region-comparative evidence is present."
      },
      "role_concentration": {
        "coded_roles": 5,
        "direct_role_specific_position_sources": 0,
        "status": "not_measurable_from_shared_relevance_tags",
        "basis": "The same executive-relevance tags apply to all supplied statements; the corpus does not measure positions by role."
      },
      "leading_source_id": "source-BATCH-2026-005-003",
      "leading_source_statement_share": 0.5,
      "high_concentration": true,
      "concentration_basis": "Share of this proposition’s mapped statement relationships attributable to the leading intellectual source; warning threshold > 0.40."
    },
    "ownership_concentration_warning": true,
    "publication_status": null,
    "workflow_status": "propositions_mapped",
    "machine_review_status": "ready_for_human_review",
    "human_review_status": "pending",
    "reviewed_by": null,
    "reviewed_at": null,
    "provenance": [
      {
        "source_url": "https://www.ietf.org/archive/id/draft-klrc-aiagent-auth-02.html",
        "accessed_at": "2026-08-15",